{
  "case_id": "HHG-007",
  "case": {
    "status": "escalated",
    "verdict": "uncertain",
    "fraud_probability": 0.314,
    "pattern": "out_of_region_use",
    "pattern_description": "",
    "affected_txn_ids": [
      "3514948"
    ],
    "first_suspicious_txn_id": "3514948",
    "connected_card_ids": [],
    "connected_device_profiles": [],
    "exposure_usd": 111.92,
    "evidence": [
      {
        "claim": "Flagged transaction 3514948 on card C09933-K2: $111.92, in_person channel, product code W, billing region 264.0. The bank model scored it 0.87, which is a reason to look, not a finding",
        "source": "graph",
        "ref": "query:tx_context(txn_id=3514948, as_of=2016-12-05 03:46:14)",
        "entity_ids": [
          "3514948",
          "C09933-K2"
        ]
      },
      {
        "claim": "Against 2434 earlier transactions on the card, the amount sits at the 71% percentile; no material deviation from the card's baseline",
        "source": "graph",
        "ref": "query:behavior_shift(customer_id=C09933, txn_id=3514948)",
        "entity_ids": [
          "C09933-K2",
          "3514948"
        ]
      },
      {
        "claim": "Pattern check out-of-region use scored 0.16: Card-present use in billing region 264 seen 2224 times before, while 2225 transactions continued in the home region 264 over the same window",
        "source": "graph",
        "ref": "query:pattern_match(pattern=out_of_region_use, card_id=C09933-K2, txn_id=3514948)",
        "entity_ids": [
          "3514948"
        ]
      },
      {
        "claim": "Billing region 264.0: has earlier history for this customer (2225 transactions, span 155.06 days); home region 264.0; neither a trip nor a clone pattern",
        "source": "graph",
        "ref": "query:region_history(customer_id=C09933, addr1=264.0)",
        "entity_ids": [
          "C09933"
        ]
      },
      {
        "claim": "19 closed case(s) before this alert touch this card or customer: 18 confirmed fraud (account_takeover, out_of_region_use), 1 cleared",
        "source": "graph",
        "ref": "query:prior_cases_for_entities(n_entities=2, as_of=2016-12-05 03:46:14)",
        "entity_ids": [
          "CC-0104",
          "CC-0657",
          "CC-0765",
          "CC-1228",
          "CC-1524",
          "CC-1682",
          "CC-2565",
          "CC-2834"
        ]
      },
      {
        "claim": "Policy R4 governs the recommended actions",
        "source": "document",
        "ref": "policy:R4",
        "entity_ids": []
      },
      {
        "claim": "Policy R8 governs the recommended actions",
        "source": "document",
        "ref": "policy:R8",
        "entity_ids": []
      },
      {
        "claim": "Evidence request customer_validation: Simulated, the dataset supplies no replies. Assumed no reply within 24 hours. The evidence is thin or conflicting: the leading pattern scores 0.16 with no independent corroboration, and there is no recurring-charge or travel explanation either, so neither a denial nor a confirmation can be assumed.",
        "source": "customer",
        "ref": "evidence_request:1",
        "entity_ids": []
      }
    ],
    "similar_prior_cases": [
      "CC-0104",
      "CC-0657",
      "CC-0765",
      "CC-1228",
      "CC-1524"
    ],
    "summary": "The bank's model flagged the transaction on card C09933-K2, transaction 3514948 ($111.92). The leading hypothesis is out-of-region use: Card-present use in billing region 264 seen 2224 times before, while 2225 transactions continued in the home region 264 over the same window. The cardholder was asked to validate the activity and no reply was assumed within 24 hours (simulated). Assessed fraud probability is 0.31 at confidence 0.76, verdict uncertain, exposure $111.92. Final recommendation: DECLINE_TRANSACTION, CREATE_CASE, MONITOR_CARD, ESCALATE_TO_ANALYST (R4, R8).",
    "written_to_graph": true,
    "graph_case_id": "GC-HHG-007"
  },
  "evidence_requests": [
    {
      "type": "customer_validation",
      "asked_after_step": 18,
      "assumed_response": "Simulated, the dataset supplies no replies. Assumed no reply within 24 hours. The evidence is thin or conflicting: the leading pattern scores 0.16 with no independent corroboration, and there is no recurring-charge or travel explanation either, so neither a denial nor a confirmation can be assumed."
    }
  ],
  "next_best_actions": {
    "initial": [
      {
        "action": "STEP_UP_AUTH",
        "route": "auto",
        "reason": "R1: the case rests on a single signal and probability is 0.31, below 0.70, so verification comes before any block"
      },
      {
        "action": "VERIFY_WITH_CUSTOMER",
        "route": "auto",
        "reason": "R1: the case rests on a single signal and probability is 0.31, below 0.70, so verification comes before any block"
      },
      {
        "action": "CREATE_CASE",
        "route": "auto",
        "reason": "Policy 3a: probability 0.31 is at or above 0.30 and evidence was requested"
      },
      {
        "action": "ESCALATE_TO_ANALYST",
        "route": "auto",
        "reason": "R8: the verdict is uncertain and the evidence conflicts"
      }
    ],
    "final": [
      {
        "action": "DECLINE_TRANSACTION",
        "route": "L1",
        "reason": "R4: no reply within 24 hours"
      },
      {
        "action": "CREATE_CASE",
        "route": "auto",
        "reason": "Policy 3a: probability 0.31 is at or above 0.30 and evidence was requested"
      },
      {
        "action": "MONITOR_CARD",
        "route": "auto",
        "reason": "R4: no reply within 24 hours"
      },
      {
        "action": "ESCALATE_TO_ANALYST",
        "route": "auto",
        "reason": "R8: the verdict is uncertain and the evidence conflicts"
      }
    ],
    "what_changed": "The assumed response (no_reply) left probability at 0.31, so the recommendation moved from STEP_UP_AUTH, VERIFY_WITH_CUSTOMER, CREATE_CASE, ESCALATE_TO_ANALYST to DECLINE_TRANSACTION, CREATE_CASE, MONITOR_CARD, ESCALATE_TO_ANALYST under R4, R8."
  },
  "sar": {
    "file": false,
    "reason": "Policy 3a: a report requires fraud confirmed or strongly suspected. Assessed probability 0.31 with verdict uncertain, so no report.",
    "narrative": "",
    "subjects": [],
    "total_amount_usd": 0.0,
    "activity_dates": []
  },
  "stop_reason": "No reply was assumed, and further graph queries are unlikely to change the decision, so the case rests on R4 and R8 rather than on more querying. Confidence 0.76. Main open question: No identity record on the flagged transaction, so device, proxy and screen are unknown",
  "tool_calls": 17,
  "tokens": 0,
  "latency_s": 1.15
}
