{
  "case_id": "HHG-009",
  "case": {
    "status": "open",
    "verdict": "uncertain",
    "fraud_probability": 0.293,
    "pattern": "card_not_present_fraud",
    "pattern_description": "",
    "affected_txn_ids": [
      "3581141"
    ],
    "first_suspicious_txn_id": "3581141",
    "connected_card_ids": [],
    "connected_device_profiles": [],
    "exposure_usd": 30.02,
    "evidence": [
      {
        "claim": "Flagged transaction 3581141 on card C08299-K1: $30.02, online channel, product code S, billing region 203.0. The bank model scored it 0.28, which is a reason to look, not a finding",
        "source": "graph",
        "ref": "query:tx_context(txn_id=3581141, as_of=2016-12-28 17:10:53)",
        "entity_ids": [
          "3581141",
          "C08299-K1"
        ]
      },
      {
        "claim": "Against 46 earlier transactions on the card, the amount sits at the 30% percentile; no material deviation from the card's baseline",
        "source": "graph",
        "ref": "query:behavior_shift(customer_id=C08299, txn_id=3581141)",
        "entity_ids": [
          "C08299-K1",
          "3581141"
        ]
      },
      {
        "claim": "Pattern check card-not-present fraud scored 0.18: Online purchase of $30.02 at the 30% percentile of this card's history",
        "source": "graph",
        "ref": "query:pattern_match(pattern=card_not_present_fraud, card_id=C08299-K1, txn_id=3581141)",
        "entity_ids": [
          "3581141"
        ]
      },
      {
        "claim": "Billing region 203.0: has earlier history for this customer (2 transactions, span 153.55 days); home region 330.0; neither a trip nor a clone pattern",
        "source": "graph",
        "ref": "query:region_history(customer_id=C08299, addr1=203.0)",
        "entity_ids": [
          "C08299"
        ]
      },
      {
        "claim": "Device profile unknown | unknown | unknown | unknown appears on 12 cards across 12 customers; the profile is common, so sharing alone is not evidence",
        "source": "graph",
        "ref": "query:shared_device_profile(device_profile=unknown | unknown | unknown | unknown)",
        "entity_ids": [
          "C08299-K1"
        ]
      },
      {
        "claim": "Policy R4 governs the recommended actions",
        "source": "document",
        "ref": "policy:R4",
        "entity_ids": []
      },
      {
        "claim": "Evidence request customer_validation: Simulated, the dataset supplies no replies. Assumed no reply within 24 hours. The evidence is thin or conflicting: the leading pattern scores 0.18 with no independent corroboration, and there is no recurring-charge or travel explanation either, so neither a denial nor a confirmation can be assumed.",
        "source": "customer",
        "ref": "evidence_request:1",
        "entity_ids": []
      }
    ],
    "similar_prior_cases": [
      "CC-1799"
    ],
    "summary": "The cardholder disputed a charge on card C08299-K1, transaction 3581141 ($30.02). The leading hypothesis is card-not-present fraud: Online purchase of $30.02 at the 30% percentile of this card's history. The cardholder was asked to validate the activity and no reply was assumed within 24 hours (simulated). Assessed fraud probability is 0.29 at confidence 0.84, verdict uncertain, exposure $30.02. Final recommendation: CREATE_CASE, MONITOR_CARD (R4).",
    "written_to_graph": true,
    "graph_case_id": "GC-HHG-009"
  },
  "evidence_requests": [
    {
      "type": "customer_validation",
      "asked_after_step": 20,
      "assumed_response": "Simulated, the dataset supplies no replies. Assumed no reply within 24 hours. The evidence is thin or conflicting: the leading pattern scores 0.18 with no independent corroboration, and there is no recurring-charge or travel explanation either, so neither a denial nor a confirmation can be assumed."
    }
  ],
  "next_best_actions": {
    "initial": [
      {
        "action": "STEP_UP_AUTH",
        "route": "auto",
        "reason": "R1: the case rests on a single signal and probability is 0.29, below 0.70, so verification comes before any block"
      },
      {
        "action": "VERIFY_WITH_CUSTOMER",
        "route": "auto",
        "reason": "R1: the case rests on a single signal and probability is 0.29, below 0.70, so verification comes before any block"
      },
      {
        "action": "CREATE_CASE",
        "route": "auto",
        "reason": "Policy 3a: evidence was requested and the customer disputes a charge"
      }
    ],
    "final": [
      {
        "action": "CREATE_CASE",
        "route": "auto",
        "reason": "Policy 3a: evidence was requested and the customer disputes a charge"
      },
      {
        "action": "MONITOR_CARD",
        "route": "auto",
        "reason": "R4: no reply within 24 hours"
      }
    ],
    "what_changed": "The assumed response (no_reply) left probability at 0.29, so the recommendation moved from STEP_UP_AUTH, VERIFY_WITH_CUSTOMER, CREATE_CASE to CREATE_CASE, MONITOR_CARD under R4."
  },
  "sar": {
    "file": false,
    "reason": "Policy 3a: a report requires fraud confirmed or strongly suspected. Assessed probability 0.29 with verdict uncertain, so no report.",
    "narrative": "",
    "subjects": [],
    "total_amount_usd": 0.0,
    "activity_dates": []
  },
  "stop_reason": "No reply was assumed, and further graph queries are unlikely to change the decision, so the case rests on R4 and R8 rather than on more querying. Confidence 0.84. Main open question: Cardholder did not reply, so the dispute is unresolved",
  "tool_calls": 17,
  "tokens": 0,
  "latency_s": 1.27
}
