{
  "case_id": "HHG-015",
  "case": {
    "status": "closed_legitimate",
    "verdict": "legitimate",
    "fraud_probability": 0.052,
    "pattern": "none",
    "pattern_description": "",
    "affected_txn_ids": [],
    "first_suspicious_txn_id": "",
    "connected_card_ids": [],
    "connected_device_profiles": [],
    "exposure_usd": 0.0,
    "evidence": [
      {
        "claim": "Flagged transaction 3464869 on card C03042-K1: $599.94, online channel, product code R, billing region 327.0. The bank model scored it 0.77, which is a reason to look, not a finding",
        "source": "graph",
        "ref": "query:tx_context(txn_id=3464869, as_of=2016-11-17 19:03:36)",
        "entity_ids": [
          "3464869",
          "C03042-K1"
        ]
      },
      {
        "claim": "Against 68 earlier transactions on the card, the amount sits at the 100% percentile; amount at the 100% percentile of the card's history; device profile new to this card; billing region new to this card",
        "source": "graph",
        "ref": "query:behavior_shift(customer_id=C03042, txn_id=3464869)",
        "entity_ids": [
          "C03042-K1",
          "3464869"
        ]
      },
      {
        "claim": "Pattern check card-not-present fraud from a new device scored 0.64: Online purchase of $599.94 at the 100% percentile of this card's history, from a device profile new to this card",
        "source": "graph",
        "ref": "query:pattern_match(pattern=card_not_present_new_device, card_id=C03042-K1, txn_id=3464869)",
        "entity_ids": [
          "3464869"
        ]
      },
      {
        "claim": "Alternative hypothesis card_not_present_fraud scored lower at 0.43; present: online_channel, amount_out_of_baseline, device_marked_new; absent: new_product_code, burst_within_48h, proxy_flag",
        "source": "graph",
        "ref": "query:pattern_match(pattern=card_not_present_fraud, card_id=C03042-K1, txn_id=3464869)",
        "entity_ids": [
          "C03042-K1"
        ]
      },
      {
        "claim": "Billing region 327.0: has earlier history for this customer (1 transactions, span 0.0 days); home region 325.0; neither a trip nor a clone pattern",
        "source": "graph",
        "ref": "query:region_history(customer_id=C03042, addr1=327.0)",
        "entity_ids": [
          "C03042"
        ]
      },
      {
        "claim": "Device profile Trident/7.0 | Windows 8.1 | ie 11.0 for desktop | 1680x1050 appears on 8 cards across 8 customers; the profile is rare enough to matter",
        "source": "graph",
        "ref": "query:shared_device_profile(device_profile=Trident/7.0 | Windows 8.1 | ie 11.0 for desktop | 1680x1050)",
        "entity_ids": [
          "C03042-K1"
        ]
      },
      {
        "claim": "3 closed case(s) before this alert touch this card or customer: 2 confirmed fraud (card_not_present_new_device), 1 cleared",
        "source": "graph",
        "ref": "query:prior_cases_for_entities(n_entities=2, as_of=2016-11-17 19:03:36)",
        "entity_ids": [
          "CC-3886",
          "CC-1313",
          "CC-0615"
        ]
      },
      {
        "claim": "Policy R3 governs the recommended actions",
        "source": "document",
        "ref": "policy:R3",
        "entity_ids": []
      },
      {
        "claim": "Evidence request step_up_auth: Simulated, the dataset supplies no replies. Assumed the cardholder confirms the purchases and states they were travelling. The charge is billed in a region this card rarely uses, with no activity elsewhere in the same twelve hours, which is a trip rather than a cloned card.",
        "source": "customer",
        "ref": "evidence_request:1",
        "entity_ids": []
      }
    ],
    "similar_prior_cases": [
      "CC-3886",
      "CC-1313",
      "CC-0615"
    ],
    "summary": "The bank's model flagged the transaction on card C03042-K1, transaction 3464869 ($599.94). The graph evidence does not support fraud: Online purchase of $599.94 at the 100% percentile of this card's history, from a device profile new to this card. The cardholder, asked to validate the activity, was assumed to confirm it (simulated response). Assessed fraud probability is 0.05 at confidence 0.82, verdict legitimate, exposure $0.00. Final recommendation: CREATE_CASE, CLOSE_NO_FRAUD (R3).",
    "written_to_graph": true,
    "graph_case_id": "GC-HHG-015"
  },
  "evidence_requests": [
    {
      "type": "step_up_auth",
      "asked_after_step": 20,
      "assumed_response": "Simulated, the dataset supplies no replies. Assumed the cardholder confirms the purchases and states they were travelling. The charge is billed in a region this card rarely uses, with no activity elsewhere in the same twelve hours, which is a trip rather than a cloned card."
    }
  ],
  "next_best_actions": {
    "initial": [
      {
        "action": "CREATE_CASE",
        "route": "auto",
        "reason": "Policy 3a: probability 0.38 is at or above 0.30 and evidence was requested"
      },
      {
        "action": "ESCALATE_TO_ANALYST",
        "route": "auto",
        "reason": "R8: the verdict is uncertain and exposure $599.94 is over $500"
      },
      {
        "action": "STEP_UP_AUTH",
        "route": "auto",
        "reason": "Policy section 6: probability 0.38 has not reached 0.85 or 0.15 on two independent pieces of evidence (confidence 0.78), so the agent asks before acting"
      }
    ],
    "final": [
      {
        "action": "CREATE_CASE",
        "route": "auto",
        "reason": "Policy 3a: evidence was requested"
      },
      {
        "action": "CLOSE_NO_FRAUD",
        "route": "auto",
        "reason": "R3: the cardholder confirms the transaction, so the alert closes as legitimate"
      }
    ],
    "what_changed": "The assumed response (confirmed) moved probability from 0.38 to 0.05, so the recommendation moved from CREATE_CASE, ESCALATE_TO_ANALYST, STEP_UP_AUTH to CREATE_CASE, CLOSE_NO_FRAUD under R3."
  },
  "sar": {
    "file": false,
    "reason": "Policy 3a: a report requires fraud confirmed or strongly suspected. Assessed probability 0.05 with verdict legitimate, so no report.",
    "narrative": "",
    "subjects": [],
    "total_amount_usd": 0.0,
    "activity_dates": []
  },
  "stop_reason": "The assumed cardholder response (confirmed) settles the question under policy section 6. Confidence 0.82. Main open question: Inculpatory and exculpatory signals are close to balanced",
  "tool_calls": 17,
  "tokens": 0,
  "latency_s": 12.39
}
